{
  "schema_version": "1.0.0",
  "proof_type": "workbook_recalculation_result",
  "proof_id": "RECALC-REL-0001",
  "release_id": "REL-0001",
  "template_id": "TMPL-0001",
  "version": "1.0.0",
  "category": "computational",
  "descriptor_sha256": "642d3c4d81d898667606140d4f50ca0c040f66c2bf602312bc57a40aea318c7c",
  "source_workbook": {
    "path": "library/templates/TMPL-0001/1.0.0/internal-close-reconciliation.xlsx",
    "sha256": "2b439f61fce015d4d3b3c78368e8deb66b8ca811d799339c848c83c47edbdf66"
  },
  "engine": {
    "name": "LibreOffice Calc",
    "version": "LibreOffice 26.2.5.2 cd7284b4cbbfeb507e630c1aac019f4157393acb"
  },
  "execution": {
    "mode": "headless_cache_stripped_copy",
    "output_format": "xlsx",
    "cache_reset": "remove_all_formula_cached_values",
    "cleared_formula_cache_count": 99,
    "prepared_cached_formula_count": 0,
    "source_before_sha256": "2b439f61fce015d4d3b3c78368e8deb66b8ca811d799339c848c83c47edbdf66",
    "source_after_sha256": "2b439f61fce015d4d3b3c78368e8deb66b8ca811d799339c848c83c47edbdf66",
    "source_unchanged": true
  },
  "formula_evidence": {
    "formula_count": 99,
    "cached_formula_count": 99,
    "formula_sheets": [
      "Reconciliation",
      "Prior_Period",
      "Checks"
    ],
    "error_count": 0,
    "control_cells": {
      "B10": "NOT APPLICABLE",
      "B11": "NOT READY",
      "B12": "NOT READY",
      "B13": "PASS",
      "B16": "NOT READY",
      "B5": "NOT READY",
      "B6": "NOT READY",
      "B7": "NOT READY",
      "B8": "NOT READY",
      "B9": "NOT READY"
    },
    "formula_results": [
      {
        "sheet": "Reconciliation",
        "cell": "C5",
        "formula": "IF(A5=\"\",\"\",SUMIFS(Source_Data!$F$5:$F$29,Source_Data!$C$5:$C$29,A5)-SUMIFS(Source_Data!$G$5:$G$29,Source_Data!$C$5:$C$29,A5))",
        "formula_attributes": {
          "aca": "false"
        },
        "cell_type": "str",
        "cached_value": "",
        "cache_present": true
      },
      {
        "sheet": "Reconciliation",
        "cell": "E5",
        "formula": "IF(A5=\"\",\"\",C5-D5)",
        "formula_attributes": {
          "aca": "false"
        },
        "cell_type": "str",
        "cached_value": "",
        "cache_present": true
      },
      {
        "sheet": "Reconciliation",
        "cell": "G5",
        "formula": "IF(A5=\"\",\"\",IF(OR(D5=\"\",F5=\"\"),\"NOT READY\",IF(ABS(E5)<=F5,\"PASS\",\"REVIEW\")))",
        "formula_attributes": {
          "aca": "false"
        },
        "cell_type": "str",
        "cached_value": "",
        "cache_present": true
      },
      {
        "sheet": "Reconciliation",
        "cell": "C6",
        "formula": "IF(A6=\"\",\"\",SUMIFS(Source_Data!$F$5:$F$29,Source_Data!$C$5:$C$29,A6)-SUMIFS(Source_Data!$G$5:$G$29,Source_Data!$C$5:$C$29,A6))",
        "formula_attributes": {
          "aca": "false"
        },
        "cell_type": "str",
        "cached_value": "",
        "cache_present": true
      },
      {
        "sheet": "Reconciliation",
        "cell": "E6",
        "formula": "IF(A6=\"\",\"\",C6-D6)",
        "formula_attributes": {
          "aca": "false"
        },
        "cell_type": "str",
        "cached_value": "",
        "cache_present": true
      },
      {
        "sheet": "Reconciliation",
        "cell": "G6",
        "formula": "IF(A6=\"\",\"\",IF(OR(D6=\"\",F6=\"\"),\"NOT READY\",IF(ABS(E6)<=F6,\"PASS\",\"REVIEW\")))",
        "formula_attributes": {
          "aca": "false"
        },
        "cell_type": "str",
        "cached_value": "",
        "cache_present": true
      },
      {
        "sheet": "Reconciliation",
        "cell": "C7",
        "formula": "IF(A7=\"\",\"\",SUMIFS(Source_Data!$F$5:$F$29,Source_Data!$C$5:$C$29,A7)-SUMIFS(Source_Data!$G$5:$G$29,Source_Data!$C$5:$C$29,A7))",
        "formula_attributes": {
          "aca": "false"
        },
        "cell_type": "str",
        "cached_value": "",
        "cache_present": true
      },
      {
        "sheet": "Reconciliation",
        "cell": "E7",
        "formula": "IF(A7=\"\",\"\",C7-D7)",
        "formula_attributes": {
          "aca": "false"
        },
        "cell_type": "str",
        "cached_value": "",
        "cache_present": true
      },
      {
        "sheet": "Reconciliation",
        "cell": "G7",
        "formula": "IF(A7=\"\",\"\",IF(OR(D7=\"\",F7=\"\"),\"NOT READY\",IF(ABS(E7)<=F7,\"PASS\",\"REVIEW\")))",
        "formula_attributes": {
          "aca": "false"
        },
        "cell_type": "str",
        "cached_value": "",
        "cache_present": true
      },
      {
        "sheet": "Reconciliation",
        "cell": "C8",
        "formula": "IF(A8=\"\",\"\",SUMIFS(Source_Data!$F$5:$F$29,Source_Data!$C$5:$C$29,A8)-SUMIFS(Source_Data!$G$5:$G$29,Source_Data!$C$5:$C$29,A8))",
        "formula_attributes": {
          "aca": "false"
        },
        "cell_type": "str",
        "cached_value": "",
        "cache_present": true
      },
      {
        "sheet": "Reconciliation",
        "cell": "E8",
        "formula": "IF(A8=\"\",\"\",C8-D8)",
        "formula_attributes": {
          "aca": "false"
        },
        "cell_type": "str",
        "cached_value": "",
        "cache_present": true
      },
      {
        "sheet": "Reconciliation",
        "cell": "G8",
        "formula": "IF(A8=\"\",\"\",IF(OR(D8=\"\",F8=\"\"),\"NOT READY\",IF(ABS(E8)<=F8,\"PASS\",\"REVIEW\")))",
        "formula_attributes": {
          "aca": "false"
        },
        "cell_type": "str",
        "cached_value": "",
        "cache_present": true
      },
      {
        "sheet": "Reconciliation",
        "cell": "C9",
        "formula": "IF(A9=\"\",\"\",SUMIFS(Source_Data!$F$5:$F$29,Source_Data!$C$5:$C$29,A9)-SUMIFS(Source_Data!$G$5:$G$29,Source_Data!$C$5:$C$29,A9))",
        "formula_attributes": {
          "aca": "false"
        },
        "cell_type": "str",
        "cached_value": "",
        "cache_present": true
      },
      {
        "sheet": "Reconciliation",
        "cell": "E9",
        "formula": "IF(A9=\"\",\"\",C9-D9)",
        "formula_attributes": {
          "aca": "false"
        },
        "cell_type": "str",
        "cached_value": "",
        "cache_present": true
      },
      {
        "sheet": "Reconciliation",
        "cell": "G9",
        "formula": "IF(A9=\"\",\"\",IF(OR(D9=\"\",F9=\"\"),\"NOT READY\",IF(ABS(E9)<=F9,\"PASS\",\"REVIEW\")))",
        "formula_attributes": {
          "aca": "false"
        },
        "cell_type": "str",
        "cached_value": "",
        "cache_present": true
      },
      {
        "sheet": "Reconciliation",
        "cell": "C10",
        "formula": "IF(A10=\"\",\"\",SUMIFS(Source_Data!$F$5:$F$29,Source_Data!$C$5:$C$29,A10)-SUMIFS(Source_Data!$G$5:$G$29,Source_Data!$C$5:$C$29,A10))",
        "formula_attributes": {
          "aca": "false"
        },
        "cell_type": "str",
        "cached_value": "",
        "cache_present": true
      },
      {
        "sheet": "Reconciliation",
        "cell": "E10",
        "formula": "IF(A10=\"\",\"\",C10-D10)",
        "formula_attributes": {
          "aca": "false"
        },
        "cell_type": "str",
        "cached_value": "",
        "cache_present": true
      },
      {
        "sheet": "Reconciliation",
        "cell": "G10",
        "formula": "IF(A10=\"\",\"\",IF(OR(D10=\"\",F10=\"\"),\"NOT READY\",IF(ABS(E10)<=F10,\"PASS\",\"REVIEW\")))",
        "formula_attributes": {
          "aca": "false"
        },
        "cell_type": "str",
        "cached_value": "",
        "cache_present": true
      },
      {
        "sheet": "Reconciliation",
        "cell": "C11",
        "formula": "IF(A11=\"\",\"\",SUMIFS(Source_Data!$F$5:$F$29,Source_Data!$C$5:$C$29,A11)-SUMIFS(Source_Data!$G$5:$G$29,Source_Data!$C$5:$C$29,A11))",
        "formula_attributes": {
          "aca": "false"
        },
        "cell_type": "str",
        "cached_value": "",
        "cache_present": true
      },
      {
        "sheet": "Reconciliation",
        "cell": "E11",
        "formula": "IF(A11=\"\",\"\",C11-D11)",
        "formula_attributes": {
          "aca": "false"
        },
        "cell_type": "str",
        "cached_value": "",
        "cache_present": true
      },
      {
        "sheet": "Reconciliation",
        "cell": "G11",
        "formula": "IF(A11=\"\",\"\",IF(OR(D11=\"\",F11=\"\"),\"NOT READY\",IF(ABS(E11)<=F11,\"PASS\",\"REVIEW\")))",
        "formula_attributes": {
          "aca": "false"
        },
        "cell_type": "str",
        "cached_value": "",
        "cache_present": true
      },
      {
        "sheet": "Reconciliation",
        "cell": "C12",
        "formula": "IF(A12=\"\",\"\",SUMIFS(Source_Data!$F$5:$F$29,Source_Data!$C$5:$C$29,A12)-SUMIFS(Source_Data!$G$5:$G$29,Source_Data!$C$5:$C$29,A12))",
        "formula_attributes": {
          "aca": "false"
        },
        "cell_type": "str",
        "cached_value": "",
        "cache_present": true
      },
      {
        "sheet": "Reconciliation",
        "cell": "E12",
        "formula": "IF(A12=\"\",\"\",C12-D12)",
        "formula_attributes": {
          "aca": "false"
        },
        "cell_type": "str",
        "cached_value": "",
        "cache_present": true
      },
      {
        "sheet": "Reconciliation",
        "cell": "G12",
        "formula": "IF(A12=\"\",\"\",IF(OR(D12=\"\",F12=\"\"),\"NOT READY\",IF(ABS(E12)<=F12,\"PASS\",\"REVIEW\")))",
        "formula_attributes": {
          "aca": "false"
        },
        "cell_type": "str",
        "cached_value": "",
        "cache_present": true
      },
      {
        "sheet": "Reconciliation",
        "cell": "C13",
        "formula": "IF(A13=\"\",\"\",SUMIFS(Source_Data!$F$5:$F$29,Source_Data!$C$5:$C$29,A13)-SUMIFS(Source_Data!$G$5:$G$29,Source_Data!$C$5:$C$29,A13))",
        "formula_attributes": {
          "aca": "false"
        },
        "cell_type": "str",
        "cached_value": "",
        "cache_present": true
      },
      {